{
  "schema": "pythonhk.team-signatures/v2",
  "registration_id": "11111111-1111-4111-8111-111111111111",
  "proposal_sha256": "replace-at-test-time",
  "algorithm": "Ed25519-multisignature-v1",
  "signatures": [
    {"github_id": "101", "key_id": "aaaaaaaaaaaaaaaaaaaaaaaaaaaaaaaaaaaaaaaaaaaaaaaaaaaaaaaaaaaaaaaa", "consent": {"kind": "team_consent", "event_id": "demo-event-2026", "actor_id": "101", "base_repository": {"id": "123456789"}, "team_id": "22222222-2222-4222-8222-222222222222", "key_id": "aaaaaaaaaaaaaaaaaaaaaaaaaaaaaaaaaaaaaaaaaaaaaaaaaaaaaaaaaaaaaaaa", "proposal_digest": "replace-at-test-time", "signature": {"key_id": "aaaaaaaaaaaaaaaaaaaaaaaaaaaaaaaaaaaaaaaaaaaaaaaaaaaaaaaaaaaaaaaa"}}},
    {"github_id": "102", "key_id": "bbbbbbbbbbbbbbbbbbbbbbbbbbbbbbbbbbbbbbbbbbbbbbbbbbbbbbbbbbbbbbbb", "consent": {"kind": "team_consent", "event_id": "demo-event-2026", "actor_id": "102", "base_repository": {"id": "123456789"}, "team_id": "22222222-2222-4222-8222-222222222222", "key_id": "bbbbbbbbbbbbbbbbbbbbbbbbbbbbbbbbbbbbbbbbbbbbbbbbbbbbbbbbbbbbbbbb", "proposal_digest": "replace-at-test-time", "signature": {"key_id": "bbbbbbbbbbbbbbbbbbbbbbbbbbbbbbbbbbbbbbbbbbbbbbbbbbbbbbbbbbbbbbbb"}}}
  ]
}
